[
  {
    "id": "RE-001",
    "domain": "realestate",
    "difficulty": "medium",
    "question": "태안군 안면읍의 평균 토지 거래 단가 (3.3㎡당) 추세는 어떤가요?",
    "expected_keywords": ["상승", "관광지", "안면도"],
    "reference_answer": "안면읍은 관광 수요와 펜션·세컨드하우스 수요로 토지 거래가가 꾸준히 상승 추세입니다. [VERIFY: 정확한 단가 확인 — 국토부 실거래가 시스템]",
    "source": "국토교통부 실거래가 공개 시스템",
    "evaluation_method": "semantic",
    "tags": ["anmyeon", "land_price", "trend"],
    "verification_status": "needs_verification"
  },
  {
    "id": "RE-002",
    "domain": "realestate",
    "difficulty": "easy",
    "question": "태안군에 외지 투자자와 귀촌인이 가장 많이 관심을 가지는 지역은 어디인가요?",
    "expected_keywords": ["안면도", "안면읍", "만리포"],
    "reference_answer": "외지 투자자·귀촌인 관심 1순위 지역은 안면도(안면읍)와 만리포·천리포 일대로, 관광 수요와 자연환경이 매력 요인입니다.",
    "source": "태안군 인구·전입 통계 [VERIFY: 통계 출처 확인]",
    "evaluation_method": "keyword_match",
    "tags": ["migration", "investment", "hotspot"],
    "verification_status": "needs_verification"
  },
  {
    "id": "RE-003",
    "domain": "realestate",
    "difficulty": "medium",
    "question": "태안군 인구 변화 추세(2020~2025)는 어떻게 되나요?",
    "expected_keywords": ["감소", "고령화", "5.9만"],
    "reference_answer": "태안군 인구는 약 5.9만 명 수준이며 최근 5년간 약 6.3% 감소하였고 고령자 비중은 39.7%로 높은 편입니다.",
    "source": "태안신문 2026 사업계획서 §02 (통계청 자료)",
    "evaluation_method": "keyword_match",
    "tags": ["demographics", "population", "aging"],
    "verification_status": "verified"
  },
  {
    "id": "RE-004",
    "domain": "realestate",
    "difficulty": "hard",
    "question": "태안 안면도 펜션 부지의 평균 평당 시세는 어느 수준인가요?",
    "expected_keywords": ["만원", "평", "위치"],
    "reference_answer": "안면도 펜션 부지 시세는 위치(해변 접근성)에 따라 편차가 크며, 해변 인접지는 평당 200만~500만원 수준입니다. [VERIFY: 최신 실거래가 확인]",
    "source": "국토부 실거래가 + 지역 부동산 시세 [VERIFY]",
    "evaluation_method": "semantic",
    "tags": ["anmyeon", "pension", "land_price"],
    "verification_status": "needs_verification"
  },
  {
    "id": "RE-005",
    "domain": "realestate",
    "difficulty": "easy",
    "question": "태안군에서 가장 인구가 많은 읍·면은 어디인가요?",
    "expected_keywords": ["태안읍"],
    "reference_answer": "태안군에서 가장 인구가 많은 행정구역은 군청 소재지인 태안읍입니다.",
    "source": "태안군 인구 통계",
    "evaluation_method": "exact",
    "tags": ["demographics", "administrative"],
    "verification_status": "needs_verification"
  },
  {
    "id": "RE-006",
    "domain": "realestate",
    "difficulty": "medium",
    "question": "태안군에 거주 주민의 평균 연령은 어느 수준인가요?",
    "expected_keywords": ["50", "고령", "39.7%"],
    "reference_answer": "태안군은 65세 이상 고령자 비중이 약 39.7%로 전국 최상위권에 속하며, 평균 연령은 50대 중후반 수준으로 추정됩니다.",
    "source": "태안신문 2026 사업계획서 §02",
    "evaluation_method": "semantic",
    "tags": ["demographics", "age"],
    "verification_status": "verified"
  },
  {
    "id": "RE-007",
    "domain": "realestate",
    "difficulty": "hard",
    "question": "최근 5년간 태안군 토지 거래 건수는 증가했나요, 감소했나요?",
    "expected_keywords": ["증가", "외지", "관광"],
    "reference_answer": "태안군 토지 거래는 외지 투자·세컨드하우스 수요로 최근 5년간 점진적 증가 추세이나, 코로나19 이후 변동성이 큽니다. [VERIFY: 국토부 통계 확인]",
    "source": "국토교통부 실거래가 시스템",
    "evaluation_method": "semantic",
    "tags": ["transaction", "trend"],
    "verification_status": "needs_verification"
  },
  {
    "id": "RE-008",
    "domain": "realestate",
    "difficulty": "medium",
    "question": "태안군이 추진하는 귀농·귀촌 지원 정책에는 어떤 것이 있나요?",
    "expected_keywords": ["주택", "정착", "지원금", "교육"],
    "reference_answer": "태안군은 귀농·귀촌인을 위한 정착지원금, 주택 수리비 지원, 영농 교육, 멘토링 프로그램 등을 운영하고 있습니다. [VERIFY: 구체 정책명·금액 확인]",
    "source": "태안군 농업기술센터 안내",
    "evaluation_method": "keyword_match",
    "tags": ["migration_policy", "support"],
    "verification_status": "needs_verification"
  },
  {
    "id": "RE-009",
    "domain": "realestate",
    "difficulty": "easy",
    "question": "태안군의 행정구역은 몇 개 읍·면으로 구성되어 있나요?",
    "expected_keywords": ["2읍", "6면", "8개"],
    "reference_answer": "태안군은 2읍(태안읍·안면읍) 6면(고남면·근흥면·남면·서남면(소원면)·소원면·원북면·이원면) 총 8개 행정구역으로 구성되어 있습니다. [VERIFY: 정확한 읍·면 구성 확인]",
    "source": "태안군 행정 안내",
    "evaluation_method": "keyword_match",
    "tags": ["administrative"],
    "verification_status": "needs_verification"
  },
  {
    "id": "RE-010",
    "domain": "realestate",
    "difficulty": "medium",
    "question": "태안에서 펜션 운영 시 받아야 하는 주요 인허가는 무엇인가요?",
    "expected_keywords": ["농어촌민박", "건축", "소방"],
    "reference_answer": "펜션 운영 시 농어촌민박업 신고(또는 숙박업 등록), 건축물 용도 검토, 소방·식품위생 등의 인허가가 필요합니다.",
    "source": "관광진흥법·농어촌정비법",
    "evaluation_method": "keyword_match",
    "tags": ["business_license", "pension"],
    "verification_status": "needs_verification"
  },
  {
    "id": "RE-011",
    "domain": "realestate",
    "difficulty": "hard",
    "question": "태안군 토지거래허가구역으로 지정된 지역이 있나요?",
    "expected_keywords": ["허가구역", "지정", "투기"],
    "reference_answer": "태안군 일부 지역(특히 안면도 일대)이 토지 투기 방지를 위해 토지거래허가구역으로 지정·해제된 이력이 있습니다. [VERIFY: 현재 지정 상태 확인]",
    "source": "국토교통부 토지거래허가구역 지정 공고",
    "evaluation_method": "factual",
    "tags": ["regulation", "anmyeon"],
    "verification_status": "needs_verification"
  },
  {
    "id": "RE-012",
    "domain": "realestate",
    "difficulty": "medium",
    "question": "태안의 평균 아파트 매매가는 충남 평균 대비 어떤가요?",
    "expected_keywords": ["낮", "저렴", "충남 평균"],
    "reference_answer": "태안 아파트 매매가는 천안·아산 등 충남 북부 도시보다 낮은 수준이며 군 단위 지역 평균과 비슷하거나 약간 높습니다. [VERIFY: 최신 KB·국토부 통계 확인]",
    "source": "KB부동산 시세 + 국토부 실거래가",
    "evaluation_method": "semantic",
    "tags": ["apartment", "price"],
    "verification_status": "needs_verification"
  },
  {
    "id": "RE-013",
    "domain": "realestate",
    "difficulty": "easy",
    "question": "외지인이 태안 농지를 매입하려면 어떤 자격 요건이 있나요?",
    "expected_keywords": ["농지취득자격증명", "농취증", "농업경영계획"],
    "reference_answer": "농지를 매입하려면 농지취득자격증명(농취증)을 발급받아야 하며, 농업경영계획서 제출 등 농지법상 요건을 충족해야 합니다.",
    "source": "농지법 제8조",
    "evaluation_method": "keyword_match",
    "tags": ["farmland", "regulation"],
    "verification_status": "verified"
  }
]
