[
  {
    "id": "GEN-001",
    "domain": "general",
    "difficulty": "easy",
    "question": "태안군은 행정구역상 어느 도(道)에 속해 있나요?",
    "expected_keywords": ["충청남도", "충남"],
    "reference_answer": "태안군은 충청남도(충남)에 속한 군 단위 행정구역입니다.",
    "source": "행정안전부 행정구역 안내",
    "evaluation_method": "keyword_match",
    "tags": ["administrative"],
    "verification_status": "verified"
  },
  {
    "id": "GEN-002",
    "domain": "general",
    "difficulty": "easy",
    "question": "태안군의 총 인구는 약 몇 명인가요?",
    "expected_keywords": ["5.9만", "59,000", "약 6만"],
    "reference_answer": "태안군 인구는 약 5.9만 명 수준(2025년 기준)입니다.",
    "source": "태안신문 2026 사업계획서 §02",
    "evaluation_method": "keyword_match",
    "tags": ["population"],
    "verification_status": "verified"
  },
  {
    "id": "GEN-003",
    "domain": "general",
    "difficulty": "medium",
    "question": "태안군청 소재지는 어디에 있나요?",
    "expected_keywords": ["태안읍"],
    "reference_answer": "태안군청은 태안읍에 위치하고 있습니다.",
    "source": "태안군청 안내",
    "evaluation_method": "exact",
    "tags": ["administrative"],
    "verification_status": "verified"
  },
  {
    "id": "GEN-004",
    "domain": "general",
    "difficulty": "medium",
    "question": "태안의 지명 '태안(泰安)'이 가지는 의미는?",
    "expected_keywords": ["크고", "평안", "큰"],
    "reference_answer": "태안(泰安)은 '크고 평안한 곳'을 뜻하며, 고려시대부터 사용된 지명입니다.",
    "source": "태안군 향토사 자료",
    "evaluation_method": "keyword_match",
    "tags": ["history", "name"],
    "verification_status": "needs_verification"
  },
  {
    "id": "GEN-005",
    "domain": "general",
    "difficulty": "hard",
    "question": "태안군에 있는 천연기념물(국가지정)은 몇 건이며 대표적인 것을 알려주세요.",
    "expected_keywords": ["신두리 해안사구", "천연기념물", "431호"],
    "reference_answer": "태안의 대표 천연기념물로 제431호 신두리 해안사구가 있으며, 이 외에도 갯벌 보전 관련 지정 사항이 있습니다. [VERIFY: 전체 지정 건수 확인]",
    "source": "문화재청 천연기념물 지정 현황",
    "evaluation_method": "keyword_match",
    "tags": ["natural_monument", "shinduri"],
    "verification_status": "needs_verification"
  },
  {
    "id": "GEN-006",
    "domain": "general",
    "difficulty": "easy",
    "question": "태안의 동쪽·서쪽·남쪽은 각각 어떤 지리적 특징이 있나요?",
    "expected_keywords": ["서해", "리아스식", "해안선", "반도"],
    "reference_answer": "태안은 충청남도 서해안에 위치한 반도형 군으로 서쪽은 서해와 접하며 리아스식 해안과 다수의 섬을 가지고 있습니다.",
    "source": "지리학 일반",
    "evaluation_method": "keyword_match",
    "tags": ["geography"],
    "verification_status": "verified"
  },
  {
    "id": "GEN-007",
    "domain": "general",
    "difficulty": "medium",
    "question": "태안과 가장 인접한 시·군 3곳은 어디인가요?",
    "expected_keywords": ["서산", "당진", "보령"],
    "reference_answer": "태안과 가장 인접한 시·군은 서산시(육로 접경), 당진시(서북), 보령시(남쪽 해안 너머)입니다.",
    "source": "행정안전부 행정구역",
    "evaluation_method": "keyword_match",
    "tags": ["geography", "neighbor"],
    "verification_status": "verified"
  },
  {
    "id": "GEN-008",
    "domain": "general",
    "difficulty": "easy",
    "question": "태안신문은 어떤 형태의 매체인가요?",
    "expected_keywords": ["지역", "신문", "지역신문"],
    "reference_answer": "태안신문은 태안군 지역 뉴스를 다루는 지역신문(지역 언론 매체)입니다.",
    "source": "태안신문(taeannews.co.kr) 소개",
    "evaluation_method": "keyword_match",
    "tags": ["media"],
    "verification_status": "verified"
  },
  {
    "id": "GEN-009",
    "domain": "general",
    "difficulty": "hard",
    "question": "태안군의 주력 산업 3가지를 알려주세요.",
    "expected_keywords": ["수산업", "관광업", "농업", "에너지"],
    "reference_answer": "태안의 주력 산업은 수산업(어업·양식), 관광업(해변·휴양), 농업(쌀·마늘 등), 에너지(태안화력) 등이 있습니다.",
    "source": "태안군 산업 안내",
    "evaluation_method": "keyword_match",
    "tags": ["economy", "industry"],
    "verification_status": "needs_verification"
  },
  {
    "id": "GEN-010",
    "domain": "general",
    "difficulty": "medium",
    "question": "태안 출신의 대표 역사 인물 1명을 알려주세요.",
    "expected_keywords": ["윤봉길", "이순신", "역사"],
    "reference_answer": "태안 출신의 대표 역사 인물은 시대별로 다르나 [VERIFY: 정확한 인물명 확인 필요], 향토사 차원에서 의병·관료 등이 기록되어 있습니다.",
    "source": "태안군 향토사 [VERIFY]",
    "evaluation_method": "factual",
    "tags": ["history", "person"],
    "verification_status": "needs_verification"
  },
  {
    "id": "GEN-011",
    "domain": "general",
    "difficulty": "medium",
    "question": "태안군의 주요 교통 접근성(고속도로·국도)을 알려주세요.",
    "expected_keywords": ["서해안고속도로", "32번", "국도"],
    "reference_answer": "태안 접근에는 서해안고속도로(서산IC·해미IC)와 국도 32번이 주로 이용됩니다.",
    "source": "한국도로공사 + 국토교통부",
    "evaluation_method": "keyword_match",
    "tags": ["transportation"],
    "verification_status": "needs_verification"
  },
  {
    "id": "GEN-012",
    "domain": "general",
    "difficulty": "easy",
    "question": "현재 태안신문이 운영 중인 공식 웹사이트 도메인은 무엇인가요?",
    "expected_keywords": ["taeannews.co.kr"],
    "reference_answer": "태안신문 공식 도메인은 taeannews.co.kr 이며, AI 인사이트 서비스는 insight.taeannews.co.kr 으로 분리 운영됩니다.",
    "source": "태안신문 사업계획서",
    "evaluation_method": "exact",
    "tags": ["media", "domain"],
    "verification_status": "verified"
  },
  {
    "id": "GEN-013",
    "domain": "general",
    "difficulty": "hard",
    "question": "태안 지역 방언의 특징 한 가지를 알려주세요.",
    "expected_keywords": ["충청", "서해안", "느림", "어미"],
    "reference_answer": "태안 방언은 충청 서해안 방언권에 속하며, 어말 어미의 끄는 듯한 느린 억양과 특유의 종결 어미가 특징입니다. [VERIFY: 학술 자료 확인]",
    "source": "한국 방언학 자료 [VERIFY]",
    "evaluation_method": "semantic",
    "tags": ["dialect", "culture"],
    "verification_status": "needs_verification"
  }
]
