[
  {
    "id": "ENV-001",
    "domain": "environment",
    "difficulty": "easy",
    "question": "태안에 위치한 대표 해양 보호 구역의 이름은 무엇인가요?",
    "expected_keywords": ["가로림만"],
    "reference_answer": "태안의 대표 해양 보호 구역은 가로림만으로, 천혜의 해양 생태계와 갯벌이 보전되어 있습니다.",
    "source": "해양수산부 해양보호구역 지정 현황",
    "evaluation_method": "keyword_match",
    "tags": ["garorim", "marine_protection"],
    "verification_status": "verified"
  },
  {
    "id": "ENV-002",
    "domain": "environment",
    "difficulty": "medium",
    "question": "신두리 해안사구의 천연기념물 지정 번호는 몇 번인가요?",
    "expected_keywords": ["431호", "제431호"],
    "reference_answer": "신두리 해안사구는 천연기념물 제431호로 지정되어 있습니다.",
    "source": "문화재청 천연기념물 지정 현황",
    "evaluation_method": "exact",
    "tags": ["shinduri", "natural_monument"],
    "verification_status": "needs_verification"
  },
  {
    "id": "ENV-003",
    "domain": "environment",
    "difficulty": "medium",
    "question": "태안 가로림만에서 보호되고 있는 대표 해양 포유류는 무엇인가요?",
    "expected_keywords": ["점박이물범", "물범"],
    "reference_answer": "가로림만에는 점박이물범이 서식하며 멸종위기 야생생물 II급으로 보호되고 있습니다.",
    "source": "국립생태원 가로림만 생태 보고서",
    "evaluation_method": "keyword_match",
    "tags": ["garorim", "seal", "endangered"],
    "verification_status": "needs_verification"
  },
  {
    "id": "ENV-004",
    "domain": "environment",
    "difficulty": "hard",
    "question": "2007년 태안 앞바다에서 발생한 기름 유출 사고의 명칭과 영향을 간단히 설명해주세요.",
    "expected_keywords": ["허베이", "스피릿", "2007", "원유", "기름"],
    "reference_answer": "2007년 12월 허베이 스피릿호 유조선 충돌로 약 12,547㎘의 원유가 유출되어 태안 일대 해안이 광범위하게 오염된 대형 환경 재난이었습니다.",
    "source": "해양수산부 사고 보고서",
    "evaluation_method": "keyword_match",
    "tags": ["oil_spill", "disaster", "2007"],
    "verification_status": "verified"
  },
  {
    "id": "ENV-005",
    "domain": "environment",
    "difficulty": "medium",
    "question": "태안 해역에서 적조가 가장 자주 발생하는 계절은 언제인가요?",
    "expected_keywords": ["여름", "8월", "7월"],
    "reference_answer": "태안 해역의 적조는 주로 수온이 상승하는 7~8월 여름철에 가장 빈번하게 발생합니다.",
    "source": "국립수산과학원 적조 발생 통계",
    "evaluation_method": "keyword_match",
    "tags": ["red_tide", "summer", "marine"],
    "verification_status": "needs_verification"
  },
  {
    "id": "ENV-006",
    "domain": "environment",
    "difficulty": "easy",
    "question": "태안 지역의 미세먼지(PM2.5) 농도는 충남 평균 대비 어떤가요?",
    "expected_keywords": ["서해안", "유사", "비슷", "낮"],
    "reference_answer": "태안은 충남 서해안 지역으로 내륙 산업단지보다 미세먼지 농도가 다소 낮은 편이나, 중국발 황사·미세먼지의 영향은 받습니다.",
    "source": "에어코리아 충남 미세먼지 통계 [VERIFY: 최신 연도 수치 확인]",
    "evaluation_method": "semantic",
    "tags": ["air_quality", "pm25"],
    "verification_status": "needs_verification"
  },
  {
    "id": "ENV-007",
    "domain": "environment",
    "difficulty": "medium",
    "question": "태안 해안 사구 생태계에서 발견되는 대표 희귀 식물 종은 무엇인가요?",
    "expected_keywords": ["통보리사초", "갯메꽃", "해당화"],
    "reference_answer": "신두리·태안 해안사구에는 통보리사초·갯메꽃·해당화 등 사구 특유의 희귀 식물 군락이 분포합니다.",
    "source": "국립생태원 신두리 사구 식생 조사",
    "evaluation_method": "keyword_match",
    "tags": ["flora", "dune", "shinduri"],
    "verification_status": "needs_verification"
  },
  {
    "id": "ENV-008",
    "domain": "environment",
    "difficulty": "hard",
    "question": "태안화력발전소의 발전 용량과 운영 주체는?",
    "expected_keywords": ["한국서부발전", "6,100MW", "석탄"],
    "reference_answer": "태안화력발전소는 한국서부발전이 운영하는 석탄화력 발전소로 총 발전 용량은 약 6,100MW 수준입니다. [VERIFY: 최신 발전 용량 확인]",
    "source": "한국서부발전 사업장 안내",
    "evaluation_method": "keyword_match",
    "tags": ["power_plant", "coal", "energy"],
    "verification_status": "needs_verification"
  },
  {
    "id": "ENV-009",
    "domain": "environment",
    "difficulty": "medium",
    "question": "태안 해변에 영향을 주는 주요 해양 쓰레기 유형은?",
    "expected_keywords": ["플라스틱", "어구", "스티로폼", "부유"],
    "reference_answer": "태안 해변의 주요 해양 쓰레기는 폐어구, 플라스틱 음료 용기, 스티로폼 부표 등이며 해류와 어업 활동에서 발생합니다.",
    "source": "해양환경공단 해양 쓰레기 모니터링",
    "evaluation_method": "keyword_match",
    "tags": ["marine_debris", "pollution"],
    "verification_status": "needs_verification"
  },
  {
    "id": "ENV-010",
    "domain": "environment",
    "difficulty": "easy",
    "question": "태안군의 평균 해수면 온도는 여름과 겨울에 각각 어느 정도인가요?",
    "expected_keywords": ["여름", "겨울", "20", "5"],
    "reference_answer": "태안 인근 서해 해수면 온도는 여름철 약 22~25°C, 겨울철 약 3~7°C 수준입니다. [VERIFY: 정확한 평균값 확인]",
    "source": "국립해양조사원 해양관측 자료",
    "evaluation_method": "semantic",
    "tags": ["sea_temperature", "climate"],
    "verification_status": "needs_verification"
  },
  {
    "id": "ENV-011",
    "domain": "environment",
    "difficulty": "medium",
    "question": "태안 갯벌의 생태적 가치를 인정받아 유네스코에서 평가된 사항이 있나요?",
    "expected_keywords": ["유네스코", "세계자연유산", "한국의 갯벌"],
    "reference_answer": "한국의 갯벌(서천·고창·신안·보성·순천)이 2021년 유네스코 세계자연유산으로 등재되었으며 태안 갯벌도 학술적으로 동일한 생태적 가치를 인정받고 있습니다. [VERIFY: 태안 직접 등재 여부 확인]",
    "source": "유네스코 세계유산 등재 현황",
    "evaluation_method": "factual",
    "tags": ["unesco", "tidal_flat"],
    "verification_status": "needs_verification"
  },
  {
    "id": "ENV-012",
    "domain": "environment",
    "difficulty": "hard",
    "question": "태안에서 진행 중인 해양 쓰레기 시민 정화 활동의 사례는?",
    "expected_keywords": ["바다살리기", "정화", "비치코밍", "환경"],
    "reference_answer": "태안에서는 '바다살리기' 운동, 정기 비치코밍, 지역 환경단체의 정화 활동 등이 진행되어 왔습니다.",
    "source": "지역 환경단체 활동 보고 [VERIFY: 구체 단체명·일정 확인]",
    "evaluation_method": "keyword_match",
    "tags": ["cleanup", "citizen", "marine_debris"],
    "verification_status": "needs_verification"
  }
]
