[
  {
    "id": "TOUR-001",
    "domain": "tourism",
    "difficulty": "easy",
    "question": "충청남도 태안군에서 가장 유명한 해수욕장 5곳을 알려주세요.",
    "expected_keywords": ["만리포", "천리포", "꽃지", "신두리", "안면도"],
    "reference_answer": "태안의 대표 해수욕장은 만리포·천리포·백리포·꽃지·신두리·몽산포 등이며, 안면도 일대에는 꽃지·삼봉·기지포 해수욕장이 있습니다.",
    "source": "태안군청 관광 안내 (www.taean.go.kr)",
    "evaluation_method": "keyword_match",
    "tags": ["beach", "overview"],
    "verification_status": "needs_verification"
  },
  {
    "id": "TOUR-002",
    "domain": "tourism",
    "difficulty": "medium",
    "question": "안면도 꽃지 해수욕장의 일몰 명소로 유명한 바위 두 개의 이름은 무엇인가요?",
    "expected_keywords": ["할미바위", "할아비바위"],
    "reference_answer": "꽃지 해수욕장의 일몰 명소는 할미바위와 할아비바위 사이로 지는 해를 볼 수 있는 곳으로 유명합니다.",
    "source": "태안군 관광지 안내",
    "evaluation_method": "keyword_match",
    "tags": ["anmyeon", "sunset", "kkotji"],
    "verification_status": "verified"
  },
  {
    "id": "TOUR-003",
    "domain": "tourism",
    "difficulty": "easy",
    "question": "태안 관광객의 연간 방문 규모는 대략 어느 수준인가요?",
    "expected_keywords": ["1,500만", "1500만"],
    "reference_answer": "태안군은 연간 약 1,500만 명 이상의 관광객이 방문하는 충남 서해안의 대표 관광지입니다.",
    "source": "태안신문 2026 사업계획서 §02 (한국관광공사 기초 자료)",
    "evaluation_method": "keyword_match",
    "tags": ["statistics", "visitors"],
    "verification_status": "verified"
  },
  {
    "id": "TOUR-004",
    "domain": "tourism",
    "difficulty": "medium",
    "question": "안면도 자연휴양림의 주요 수종과 특징을 알려주세요.",
    "expected_keywords": ["소나무", "안면송", "휴양림"],
    "reference_answer": "안면도 자연휴양림은 안면송(소나무)이 우거진 천연림으로, 약 430ha에 달하는 송림이 특징입니다.",
    "source": "산림청 자연휴양림 안내",
    "evaluation_method": "keyword_match",
    "tags": ["anmyeon", "forest", "pine"],
    "verification_status": "needs_verification"
  },
  {
    "id": "TOUR-005",
    "domain": "tourism",
    "difficulty": "medium",
    "question": "태안의 대표 어종이며 가을 별미로 알려진 수산물은 무엇인가요?",
    "expected_keywords": ["대하", "꽃게", "우럭"],
    "reference_answer": "태안의 대표 가을 별미는 대하(큰새우), 꽃게, 우럭이며 특히 안면도 대하축제는 매년 가을에 열립니다.",
    "source": "태안군 축제 안내",
    "evaluation_method": "keyword_match",
    "tags": ["food", "festival", "autumn"],
    "verification_status": "needs_verification"
  },
  {
    "id": "TOUR-006",
    "domain": "tourism",
    "difficulty": "hard",
    "question": "태안 8경 중 안면도와 관련된 명소를 두 개 이상 말씀해주세요.",
    "expected_keywords": ["꽃지", "방포", "안면송"],
    "reference_answer": "태안 8경 중 안면도 관련 명소로는 꽃지 해수욕장 일몰, 방포 해변, 안면도 자연휴양림(안면송) 등이 포함됩니다.",
    "source": "태안군청 8경 안내 [VERIFY: 8경 공식 목록 확인 필요]",
    "evaluation_method": "keyword_match",
    "tags": ["anmyeon", "eight_views"],
    "verification_status": "needs_verification"
  },
  {
    "id": "TOUR-007",
    "domain": "tourism",
    "difficulty": "easy",
    "question": "태안 만리포 해수욕장의 백사장 길이는 약 몇 km인가요?",
    "expected_keywords": ["3km", "3킬로", "3.5km"],
    "reference_answer": "만리포 해수욕장은 백사장 길이 약 3km로 서해안의 대형 해수욕장 중 하나입니다.",
    "source": "태안군청 만리포 해수욕장 안내",
    "evaluation_method": "keyword_match",
    "tags": ["malliro", "beach", "scale"],
    "verification_status": "needs_verification"
  },
  {
    "id": "TOUR-008",
    "domain": "tourism",
    "difficulty": "medium",
    "question": "태안의 갯벌 체험으로 유명한 지역과 주요 채취 어종은?",
    "expected_keywords": ["몽산포", "근소만", "바지락", "낙지"],
    "reference_answer": "태안 몽산포·근소만 일대 갯벌에서 바지락·낙지·맛조개 채취 체험이 가능합니다.",
    "source": "태안군 어촌 체험 안내",
    "evaluation_method": "keyword_match",
    "tags": ["mudflat", "experience", "shellfish"],
    "verification_status": "needs_verification"
  },
  {
    "id": "TOUR-009",
    "domain": "tourism",
    "difficulty": "hard",
    "question": "태안의 주요 축제 3개와 각각의 개최 시기를 알려주세요.",
    "expected_keywords": ["튤립", "대하", "꽃박람회"],
    "reference_answer": "태안의 주요 축제로는 안면도 국제꽃박람회(봄), 만리포 사랑 노래자랑(여름), 안면도 대하축제(가을) 등이 있습니다.",
    "source": "태안군 축제 일정 [VERIFY: 연도별 일정 확인 필요]",
    "evaluation_method": "keyword_match",
    "tags": ["festival", "schedule"],
    "verification_status": "needs_verification"
  },
  {
    "id": "TOUR-010",
    "domain": "tourism",
    "difficulty": "medium",
    "question": "태안 신두리 해안사구가 천연기념물로 지정된 이유는 무엇인가요?",
    "expected_keywords": ["사구", "해안", "보전", "생태"],
    "reference_answer": "신두리 해안사구는 국내 최대 규모의 해안사구로, 독특한 사구 생태계와 희귀 식물 군락이 분포해 천연기념물 제431호로 지정되었습니다.",
    "source": "문화재청 천연기념물 제431호",
    "evaluation_method": "keyword_match",
    "tags": ["shinduri", "dune", "natural_monument"],
    "verification_status": "needs_verification"
  },
  {
    "id": "TOUR-011",
    "domain": "tourism",
    "difficulty": "easy",
    "question": "태안에서 서울에서 자동차로 이동 시 평균 소요 시간은 얼마인가요?",
    "expected_keywords": ["2시간", "2시간 30분", "서해안고속도로"],
    "reference_answer": "서울에서 태안까지는 서해안고속도로를 이용해 약 2시간~2시간 30분 소요됩니다.",
    "source": "한국도로공사 교통 정보",
    "evaluation_method": "keyword_match",
    "tags": ["access", "transportation"],
    "verification_status": "needs_verification"
  },
  {
    "id": "TOUR-012",
    "domain": "tourism",
    "difficulty": "hard",
    "question": "안면도와 본토를 연결하는 다리의 이름과 완공 연도를 알려주세요.",
    "expected_keywords": ["연륙교", "안면대교", "1970"],
    "reference_answer": "안면도는 1970년 안면대교(연륙교) 완공으로 본토와 연결되어 사실상 섬에서 육지화되었습니다.",
    "source": "태안군 행정 자료 [VERIFY: 정확한 완공 연도 확인 필요]",
    "evaluation_method": "keyword_match",
    "tags": ["anmyeon", "bridge", "history"],
    "verification_status": "needs_verification"
  }
]
